{
  "benchmark": {
    "id": "csfb",
    "version": "0.2.0-preview",
    "protocol_version": "0.1.0-draft",
    "mode": "OPEN_SUITE"
  },
  "system_under_test": {
    "id": "global-exact",
    "version": "0.2.0"
  },
  "dataset": {
    "version": "0.2.0-preview",
    "hash": "242a593739e55a02f305ffce0350425b04d5aad0ef1781d0a4190ab67195fcdf",
    "cases": 6629,
    "events": 48851
  },
  "metrics": {
    "final_accuracy": { "value": 0.9068, "unit": "ratio", "cases": 6629 },
    "within_1_accuracy": { "value": 0.9218, "unit": "ratio" },
    "catastrophic_absolute": { "value": 0.0152, "unit": "ratio" },
    "wrong_backward": { "value": 0.0126, "unit": "ratio" },
    "false_jump_commit": { "value": 0.1079, "unit": "ratio" }
  },
  "category_breakdown": {
    "language": {
      "zh": { "cases": 6003 },
      "en": { "cases": 40 },
      "mixed": { "cases": 586 }
    },
    "navigation": {
      "intentional_skip": { "cases": 144 },
      "forgotten_then_skip": { "cases": 120 },
      "accidental_future_phrase": { "cases": 140 },
      "forgotten_word_pause": { "cases": 140 }
    }
  },
  "failures": {
    "count": 618,
    "categories": {
      "wrong_backward": 84,
      "false_jump_commit": 715,
      "catastrophic_absolute": 101
    }
  },
  "runtime": {
    "host": "reference-run",
    "python": "3.12",
    "duration_seconds": 146.2
  },
  "reproducibility": {
    "deterministic": true,
    "logical_prediction_sha256": "6d702632d943b3d8faa942b334c14859aae87bf3942478837d4b0ed4b31b2567",
    "logical_metrics_sha256": "ebb46141d778fbc0d204d42b4baf8bb55644f91192fd4d94941edc42f0975a13"
  }
}
